{
  "jsonrpc": "2.0",
  "id": "eval-0-attempt-1",
  "method": "gate/evaluate",
  "params": {
    "schemaVersion": 1,
    "evaluationId": "eval-0",
    "attemptId": "eval-0-attempt-1",
    "gateId": "synthetic-check",
    "missionId": "m-fixture",
    "binding": {
      "subjectDigest": "sha256:459a972b00a172fa6243c1dadfe6eacd9f101577c01b8add67b2be825f47ea5c",
      "planDigest": "sha256:a31db2cdc410cefb3bf98cea758926fefd700cffa031a819e22cee176426ebc2",
      "policyDigest": "sha256:c82fc52c78bf8154d4dd7d8766c422ab151052d72098d72ded237aafcd78e4e0",
      "registrationDigest": "sha256:072cd9d78fd1c10792937c50c01bfa661dd0fc86262d5e7d3eef7cd26c336022",
      "workspaceId": "workspace-fixture"
    },
    "stage": "plan-approval",
    "subject": {
      "kind": "plan",
      "revision": 1,
      "planDigest": "sha256:a31db2cdc410cefb3bf98cea758926fefd700cffa031a819e22cee176426ebc2",
      "baseCommit": {
        "algorithm": "sha1",
        "value": "1111111111111111111111111111111111111111"
      }
    },
    "evidence": {
      "path": "inputs/manifest.json",
      "digest": "sha256:70a0f2d8ec027a20abef58103fc6f8085a71e56d1ed8424f12ebfe4edfd32678",
      "bytes": 704
    },
    "deadline": "2030-01-01T00:00:00Z",
    "limits": {
      "wallTimeMs": 10000,
      "writeTimeMs": 1000,
      "maxFrameBytes": 65536,
      "maxStdoutBytes": 65536,
      "maxStderrBytes": 65536,
      "maxArtifactBytes": 1048576,
      "maxArtifacts": 8
    }
  }
}
