{
  "jsonrpc": "2.0",
  "id": "eval-1-attempt-1",
  "method": "gate/evaluate",
  "params": {
    "schemaVersion": 1,
    "evaluationId": "eval-1",
    "attemptId": "eval-1-attempt-1",
    "gateId": "synthetic-check",
    "missionId": "m-fixture",
    "binding": {
      "subjectDigest": "sha256:2bfeb9db798dafef90eaaf0f3419710c98909d3370a553d99a0dc7202b5ec2ae",
      "planDigest": "sha256:a31db2cdc410cefb3bf98cea758926fefd700cffa031a819e22cee176426ebc2",
      "policyDigest": "sha256:c82fc52c78bf8154d4dd7d8766c422ab151052d72098d72ded237aafcd78e4e0",
      "registrationDigest": "sha256:072cd9d78fd1c10792937c50c01bfa661dd0fc86262d5e7d3eef7cd26c336022",
      "workspaceId": "workspace-fixture"
    },
    "stage": "command-permission",
    "subject": {
      "kind": "invocation",
      "runId": "run-fixture",
      "peerSessionId": "peer-fixture",
      "toolCallId": "tool-fixture",
      "peerRequestId": 9,
      "actionDigest": "sha256:c8d5009c6f5c64eab9a06c359d8cd34fec02dac205f27d69470a24573c88f5f1",
      "optionsDigest": "sha256:dafa57bb42e7274b83e560e2c3f3cfd2456ff75874c25744090c4772f8886461",
      "cwdId": "workspace-fixture"
    },
    "evidence": {
      "path": "inputs/manifest.json",
      "digest": "sha256:e048352792a93bcd1c756e503cb75479b406d67a2b3690f68a0e335a1b6fd5e6",
      "bytes": 704
    },
    "deadline": "2030-01-01T00:00:00Z",
    "limits": {
      "wallTimeMs": 10000,
      "writeTimeMs": 1000,
      "maxFrameBytes": 65536,
      "maxStdoutBytes": 65536,
      "maxStderrBytes": 65536,
      "maxArtifactBytes": 1048576,
      "maxArtifacts": 8
    }
  }
}
